{"assetSetSha256":"971826ab0bf91a64b19b1058a261cb8a6048d907424c52a1fb6944464bfd29da","assetsSchema":1,"buildProfileSha256":"dddddddddddddddddddddddddddddddddddddddddddddddddddddddddddddddd","entryBundles":["bootstrap/ui"],"mode":"diagnostic","protocolProfile":null,"requiredBrowserFeatures":["wasm","webgl2"],"runtime":{"entryModule":"shell/entry","files":[{"bytes":10,"id":"shell/entry","mediaType":"text/javascript","sha256":"1111111111111111111111111111111111111111111111111111111111111111"},{"bytes":20,"id":"runtime/client","mediaType":"application/wasm","sha256":"2222222222222222222222222222222222222222222222222222222222222222"}],"wasmModule":"runtime/client"},"schema":1,"sourceClient":"1.5.3","sourceCommit":"cccccccccccccccccccccccccccccccccccccccc","sourceManifestSha256":"aaaaaaaaaaaaaaaaaaaaaaaaaaaaaaaaaaaaaaaaaaaaaaaaaaaaaaaaaaaaaaaa","toolchainLockSha256":"bbbbbbbbbbbbbbbbbbbbbbbbbbbbbbbbbbbbbbbbbbbbbbbbbbbbbbbbbbbbbbbb","upstreamCommit":"e3d6d0075d0a745c9f9859f2cb25b01d71dec045"}